,,Mô tả khóa học,Yêu cầu,Lợi ích từ khóa học,Đối tượng mục tiêu,Chương trình giảng dạy,,
Tiếng Đức đơn giản: Một Khóa Học Đầy đủ cho Người Học Nghiêm Túc,"Học để nói, viết và hiểu tiếng Đức nhanh chóng và dễ dàng để đạt được những mục tiêu nghề nghiệp và mục tiêu cá nhân của bạn.","THAM DỰ CÙNG VỚI HƠN 2800 HỌC SINH THÀNH CÔNG VỪA MỚI THAM GIA KHÓA HỌC NÀY
Học ngữ pháp, từ vựng và các kỹ năng giao tiếp mà bạn cần để trở thành một người nói tiếng Đức trôi chảy.
Khóa học này là hoàn hảo nếu bạn muốn: 
Làm chủ các tình huống hàng ngày trong một đất nước nói tiếng Đức
Giao tiếp một cách chính xác những điều mà bạn muốn nói
Tự nhiên trong các cuộc hội thoại và thảo luận
Phát triển các kỹ năng đọc, viết, nói và kỹ năng nghe của bạn
""Ingo có một tấn kinh nghiệm trong giảng dạy tiếng Đức. Bạn có thể nói về tất cả các thực hành tốt nhất và các bí quyết hay đến với cuộc sống ở đây. Nhịp độ của ông là hoàn hảo cho những người mới bắt đầu nên đừng lo lắng! Lời khuyên chân thành."" - Gabriel John Rodriguez
Đề cập các khái niệm cơ bản và sau đó tiến độ sẽ nhanh hơn
Nếu bạn là người mới bắt đầu hoàn toàn, quá bận rộn cho một lớp học ngôn ngữ, hoặc cần ôn lại trước kỳ nghỉ hay sau một chuyến công tác thì đây là khóa học dành cho bạn. Nó bao gồm tất cả 4 kỹ năng cơ bản: Nói, nghe, đọc và viết, và bạn có thể thích sự tự do và sự linh hoạt để học ở nhịp độ của riêng bạn.
Từ vựng và ngữ pháp được dạy thông qua các văn bản và hội thoại dựa trên các tình huống hàng ngày, sắp xếp từ bài nói về sở thích, thói quen hàng ngày đến bài đặt món ăn trong một nhà hàng và đặt lịch với bác sĩ.
""Khóa học này rất tuyệt ở nhiều cấp độ. Nó thực sự vạch ra những vấn đề cơ bản và xây dựng một nền tảng vững chắc. Những điều này được giải thích và giảng dạy dưỡi một hình thức đơn giản và rõ ràng. Sự tiến triển cũng rất đáng khích lệ bởi vì nó tiếp tục xây dựng dựa trên các bài học trước đó. Tôi đánh giá cao khóa học này ""- Peter Hamon
Bắt đầu cấu thành câu sau bài học đầu tiên
Các ngôn ngữ được tiếp cận theo phương pháp chức năng và giao tiếp để bạn có thể dễ dàng sử dụng những gì bạn đã học được để giao tiếp bằng tiếng Đức một cách hiệu quả.
Tôi đã nắm được sự giải thích ngữ pháp đơn giản và thân thiện nhất có thể cho phép bạn tiến bộ với một tốc độ ổn định nhưng đồng thời nâng sự hiểu biết âm thanh về cách ngôn ngữ làm việc như thế nào và do đó xây dựng nên sự tự tin của bạn.
""Các giảng viên có niềm say mê trong giảng dạy với cách tiếp cận rất thực tế. Các tình huống hàng ngày được đưa vào theo một cách rất rõ ràng làm cho nó dễ dàng để nhớ. Tôi sẽ giới thiệu nó cho bất cứ ai bắt đầu học tiếng Đức"". - Arian Celina
Đây là những gì bạn có thể mong đợi:
Chuyên nghiệp, vui vẻ và các bài học dễ hiểu
Bài tập hấp dẫn, cho phép bạn kiểm tra trình độ hiểu biết của bạn
Hướng dẫn bài học để xây dựng các kỹ năng giao tiếp của bạn giao tiếp
Hỗ trợ đặc biệt và những câu trả lời nhanh chóng cho các câu hỏi của bạn
Phiên bản âm thanh MP3 có thể tải về của tất cả các bài học để nghe trên đường đi
Bảo đảm hoàn trả lại tiền trong 30 ngày mà không hỏi bất cứ câu hỏi nào
Và điều cuối cùng nhưng không kém phần quan trọng ..........để học tiếng Đức một cách nhanh chóng!
Bạn đã sẵn sàng chưa? Tham gia khóa này và bắt đầu nói tiếng Đức ngay lập tức!","Đây là khóa học cho người mới bắt đầu với yêu cầu là không có kiến thức về tiếng Đức trước đó.
Ngôn ngữ hướng dẫn là tiếng Anh","Hơn 81 bài giảng và 4,5 giờ nội dung!
Chào hỏi và giới thiệu bản thân và những người khác ở Đức
Giao tiếp thành công trong các tình huống hàng ngày
Nói về thói quen hàng ngày của bạn và thảo luận về thời tiết
Sắp xếp cuộc hẹn và sắp xếp các buổi gặp mặt/ cuộc họp
Viết, chỉnh sửa và đọc lại đoạn văn ngắn bằng tiếng Đức","Khóa học này dành cho những sinh viên không có kiến thức về tiếng Đức trước đố và muốn nâng cao trình độ ngoại ngữ của họ trong một khoảng thời gian ngắn.
Nếu bạn đang học lại tiếng Đức một lần nữa sau một thời gian gián đoạn, bạn cũng sẽ nhận thấy khóa học này rất phù hợp với nhu cầu của bạn.
Khóa học cũng phục vụ như một bài hướng dẫn tham khảo thuận tiện cho việc học ngữ pháp tiếng Đức với lời giải thích rõ ràng và bổ ích và được tập trung vào các hoạt động thực hành.",Phần 1: Giới thiệu,Phần 1: Giới thiệu,
,,,,,,,"Giới thiệu
",3:34
,,,,,,,Học tiếng Đức - 5 điều bạn cần biết,Testo
,,,,,,,Làm thế nào để không bao giờ quên từ vựng lần nữa,4:11
,,,,,,,Bí quyết để sử dụng thành thạo,2:03
,,,,,,,Làm thế nào để cải thiện sự trình độ nghe của bạn,Testo
,,,,,,Phần 2: Gặp gỡ Mọi người,,
,,,,,,,"Làm thế nào để giới thiệu bản thân
",7:29
,,,,,,,Bảng chữ cái và âm thanh,8:25
,,,,,,,Đại Từ Nhân Xưng,1:31
,,,,,,,Cách nói trang trọng và không trang trọng,3:54
,,,,,,,Kết thúc của động từ,6:10
,,,,,,,Điền vào chỗ trống với dạng kết thúc đúng của động từ,7 domande
,,,,,,,"Động từ: Nói
Xem trước ",3:07
,,,,,,,"Điền vào chỗ trống với các dạng đúng của động từ ""nói""",7 domande
,,,,,,,"Trật Tự Từ
Xem trước ",2:46
,,,,,,,Đặt câu theo thứ tự từ đúng,5 domande
,,,,,,,Các Quốc gia và Ngôn ngữ,5:01
,,,,,,,Số đếm từ 1 đến 20,1:28
,,,,,,,Cách tốt nhất để học và thực hành về số đếm,Testo
,,,,,,,"Thực hành Nói
Xem trước ",2:05
,,,,,,,Thực hành viết,Testo
,,,,,,,Chào hỏi - Từ vựng bổ sung,Testo
,,,,,,Phần 3: Nói về Gia đình của bạn,,
,,,,,,,"Nghề nghiệp, Gia đình, Sở thích",3:50
,,,,,,,Động từ: Giới thiệu,2:52
,,,,,,,"Các động từ: Đọc, Xem",2:49
,,,,,,,Điền vào các khoảng trống với các động từ liên hợp chính xác,9 domande
,,,,,,,Đại từ Sở hữu I,5:33
,,,,,,,Điền vào chỗ trống với các đại từ sở hữu đúng,7 domande
,,,,,,,Số đếm: từ 20 đến 100,3:09
,,,,,,,Nói Thích và Không thích,3:36
,,,,,,,Dạng phủ định: Không,2:59
,,,,,,,Đặt câu theo thứ tự từ đúng,6 domande
,,,,,,,"Thực hành Nói
Xem trước ",1:39
,,,,,,,Thực hành Viết,Testo
,,,,,,,Gia đình - Từ vựng bổ sung,Testo
,,,,,,Phần 4: Khám phá các vùng lân cận xung quanh bạn,,
,,,,,,,Đi bộ trong Thành phố,4:27
,,,,,,,Mạo từ Xác định và Không xác định,2:09
,,,,,,,Đại từ Sở hữu II,4:49
,,,,,,,Điền vào chỗ trống với các đại từ sở hữu đúng,4 domande
,,,,,,,Dạng phủ định: Chưa,3:14
,,,,,,,Thể Akkusativ,5:25
,,,,,,,,8 domande
,,,,,,,Điền dạng đúng của Akkusativ,3:03
,,,,,,,"Điền dạng đúng của động từ ""Có""",4 domande
,,,,,,,Giờ mở cửa,4:54
,,,,,,,Thực hành Nói,2:07
,,,,,,,Thực hành Viết,Testo
,,,,,,Phần 5: Đi đến Nhà hàng,,
,,,,,,,"Làm thế nào để gọi Món ăn và Đồ uống
Xem trước",4:48
,,,,,,,Một thực đơn đặc biệt,3:01
,,,,,,,Kết thúc của tính từ: Akkusativ,4:00
,,,,,,,Điền dạng đúng của các mạo từ và tính từ,9 domande
,,,,,,,Động từ: Muốn,3:31
,,,,,,,"Các động từ: Lấy, Ăn",2:20
,,,,,,,Động từ khuyết thiếu: Có thể,4:29
,,,,,,,Điền dạng đúng của động từ,10 domande
,,,,,,,Danh từ số nhiều,3:35
,,,,,,,"Động từ""Có"" và ""Giới thiệu"" ở thì Quá khứ (Thì quá khứ)",4:49
,,,,,,,"Điền dạng đúng của động từ ""Có"" và ""Giới thiệu"" (Thì quá khứ)",9 domande
,,,,,,,Thực hành Nói,2:05
,,,,,,,Thực hành Viết,Testo
,,,,,,,Món ăn - Từ vựng bổ sung,Testo
,,,,,,Phần 6: Miêu tả Thói quen hàng ngày của bạn,,
,,,,,,,Một ngày đặc biệt,6:38
,,,,,,,"Nói về Thời gian
Xem trước",2:54
,,,,,,,Đại từ nhân xưng  Akkusativ,3:30
,,,,,,,Điền vào chỗ trống với các đại từ nhân xưng đúng,7 domande
,,,,,,,Thì quá khứ hoàn thành,6:06
,,,,,,,"Điền dạng đúng của động từ ""Có"" và phân từ quá khứ",9 domande
,,,,,,,Thì quá khứ hoàn thành: Các động từ bất quy tắc,4:29
,,,,,,,Các động từ phân tách,4:55
,,,,,,,Điền vào chỗ trống với dạng đúng của động từ (hiện tại),6 domande
,,,,,,,Một ngày đặc biệt - Thì quá khứ,4:54
,,,,,,,"Điền dạng đúng của động từ ""Có"" hoặc ""Giới thiệu"" + phân từ quá khứ",9 domande
,,,,,,,Dạng phủ định của các động từ thì quá khứ,2:55
,,,,,,,Thực hành Nói,3:23
,,,,,,,Thực hành Viết,Testo
,,,,,,Phần 7: Đi du lịch,,
,,,,,,,Thời tiết,5:12
,,,,,,,Mua Vé,3:45
,,,,,,,Động từ khuyết thiếu: Muốn,3:22
,,,,,,,Giới từ chỉ hướng,2:49
,,,,,,,Điền vào chỗ trống với các giới từ chỉ hướng đúng,6 domande
,,,,,,,Từ nối: Đó/ vì,6:51
,,,,,,,"Điền vào chỗ trống với các từ ""Đó"" hoặc ""Vì""",8 domande
,,,,,,,Thể Dativ,6:29
,,,,,,,"Điền vào chỗ trống với dạng đúng của ""Dativ""",9 domande
,,,,,,,Di chuyển và Địa điểm ,5:33
,,,,,,,"Chọn dạng đúng của từ ""ở""",7 domande
,,,,,,,Tháng trong năm,2:39
,,,,,,,Thực hành Nói,2:48
,,,,,,,Thực hành Viết,Testo
,,,,,,,Quần áo - Từ vựng bổ sung,Testo
,,,,,,Phần 8: Hẹn Gặp,,
,,,,,,,Gọi cho Bác sĩ,3:24
,,,,,,,Bộ phận cơ thể,2:47
,,,,,,,Ra ngoài với Bạn bè,5:08
,,,,,,,Động từ khuyết thiếu: Cần phải,3:06
,,,,,,,Đại từ nhân xưng Dativ,4:34
,,,,,,,Điền vào chỗ trống với đại từ nhân xưng đúng,8 domande
,,,,,,,Các động từ với Dativ và Akkusativ,3:19
,,,,,,,Điền vào chỗ trống với dạng đúng (Dativ/Akkusativ),9 domande
,,,,,,,Đọc Ngày Tháng,5:47
,,,,,,,Nhiều hơn Giới từ với Dativ,4:09
,,,,,,,Điền vào chỗ trống với giới từ đúng,9 domande
,,,,,,,Thực hành Nói,2:57
,,,,,,,Thực hành Viết,Testo
,,,,,,,Cơ thể - Từ vựng bổ sung,Testo
,,,,,,Phần 9: Kết luận và các bước tiếp theo,,
,,,,,,,Chúc mừng!,1:20
,,,,,,,Chương trình dạy đầy đủ,
,,,,,,Lý lịch giảng viên,,