,,Mô tả khóa học,Yêu cầu,Lợi ích từ khóa học,Đối tượng mục tiêu,Chương trình giảng dạy,,
Làm thế nào để học và nhớ các từ vựng của bất kỳ ngôn ngữ  nào,Sử dụng phương pháp Bộ nhớ từ tính,"Học một ngôn ngữ mới khác nhiều so với việc cải thiện một ngôn ngữ bạn đã biết. Não buộc phải truy cập nhiều thông tin khác nhau, và điều này có thể nhanh chóng làm quá tải bộ nhớ truyền thống của chúng ta. Khóa học này nhằm mục đích vượt qua thử thách này, bằng cách giới thiệu một hình thức ghi nhớ mới cho việc học ngoại ngữ.
Làm chủ ngoại ngữ nhanh chóng bằng cách sử dụng phương pháp ghi nhớ Bộ nhớ từ tính
Xây dựng Cung điện trí nhớ Ngữ pháp và bài tập thực hành
Nguyên tắc của vị trí, thứ tự bảng chữ cái, tưởng tượng, và hành động
Lưu trữ, nhớ lại, và kiểm tra thuộc lòng bảng chữ cái và từ vựng ngoại ngữ
Nắm vững từ vựng bằng cách sử dụng kỹ thuật bộ nhớ đơn giản
Có rất nhiều lợi ích từ việc biết một hoặc nhiều ngoại ngữ khác nhau. Bạn có thể trở thành một nhân viên có giá trị hơn trong nhiều ngành công nghiệp, đặc biệt là trong một nền kinh tế toàn cầu. Bạn cũng có thể đi đến các khu vực khác nhau trên thế giới một cách dễ dàng nếu bạn biết một số ngoạingữ bởi các kỹ năng này sẽ cho phép bạn giao tiếp dễ dàng.
Nhưng làm chủ một vốn từ vựng hoàn toàn khác so với ngôn ngữ mẹ đẻ của bạn có thể tốn nhiều thời gian và vô cùng khó khăn. Đó là lý do tại sao có những chương trình dạy bạn làm thế nào để huấn luyện đầu óc bạn nắm bắt những từ mới và học cách giao tiếp bằng ngôn ngữ khác. Phương pháp nhớ từ tính, được tạo ra bởi Tiến sĩ Anthony Metivier, làm cho việc học một ngôn ngữ mới vui vẻ hơn bằng cách sử dụng thuật nhớ, Cung điện trí nhớ, và các kỹ thuật khác cho việc ghi nhớ từ vựng.
Nội dung và Tổng quan
Khóa học này có hơn 50 bài giảng và 8 giờ nội dung. Nó được thiết kế cho bất cứ ai, bất kể trình độ  về kinh nghiệm, những người mong muốn cải thiện trí nhớ của họ và tìm hiểu một ngoại ngữ mới cùng một lúc.
Trong khóa học này, bạn sẽ được học các phương pháp bộ nhớ từ tính, và bạn sẽ hiểu  Phòng Ghi nhỡ là gì và làm thế nào để xây dựng một Cung điện trí nhớ cho bản thân
Sau đó, bạn sẽ tìm hiểu, sử dụng các nguyên tắc phân chia từ, làm thế nào để lấp đầy Phòng Ghi nhỡ của bạn với các từ vựng của bất kỳ ngoại ngữ bạn muốn làm chủ.
Và, cuối cùng, bạn sẽ tìm hiểu làm thế nào để kiểm tra thu hồi của bạn về những lời nói, bằng cách sử dụng Excel để lưu trữ từ vựng của bạn và quiz mình.
Đến cuối khóa học này, bạn sẽ có những kỹ năng có giá trị giúp bạn nhanh chóng ghi nhớ và sử dụng một bảng chữ cái nước ngoài, bất kể như thế nào tốt bộ nhớ của bạn là khi bạn bắt đầu. Bạn sẽ biết làm thế nào để ghi nhớ các từ vựng của nhiều ngôn ngữ cùng một lúc, và làm thế nào để ghi nhớ đúng chính tả của các từ mới.
Bạn cũng sẽ nhận được tài liệu tiền thưởng mà củng cố các khái niệm bạn đã học được và cung cấp cho bạn thủ thuật mới để cải thiện trí nhớ của bạn. Với những bài học này, bạn sẽ thấy rằng bạn có thể đọc, nói và viết bằng tiếng nước ngoài trong một thời gian ngắn.
Chi tiết khóa học",Một thái độ cầu thị sẵn sàng thử nghiệm,"Hơn 71 bài giảng và 13,5 giờ nội dung!
Đến cuối khóa học, bạn sẽ có thể xây dựng Cung điện trí nhớ cho riêng bản được thiết kế hoàn hảo cho việc ghi nhớ từ vựng
Bạn sẽ có khả năng nhớ lại những từ vựng mà bạn đã học thuộc lòng một cách dễ dàng
Khả năng nói của bạn sẽ trở nên lưu loát hơn và bạn có thể đọc báo bằng tiếng nước ngoài, xem hiểu phim ảnh và âm nhạc và tham gia vào các cuộc đàm thoại với ngôn ngữ phức tạp hơn nhiều so với trước đây do sự phát triển vượt bực trong vốn từ vựng của mình
Bạn sẽ sáng tạo hơn và có khả năng suy nghĩ một cách hoàn toàn mới","Những người học ngôn ngữ 
Những người quan tâm đến việc cải thiện trí nhớ của họ",Phần 1: Giới thiệu về phương pháp Bộ nhớ từ tính,,
,,,,,,,"Lướt nhanh qua ""Lời giới thiệu""",6 trang
,,,,,,,Chào mừng bạn đến với khóa học!,5:22
,,,,,,,Nõi đau và sự thất vọng trong quá trình học ngoại ngữ,Văn bản
,,,,,,,Làm thế nào để dễ dàng theo dõi khóa học này từ đầu đến cuối và ghi nhớ mọi thứ,4:49
,,,,,,,"Mục tiêu khóa học & Cấu trúc khóa học
Xem trước ",7:28
,,,,,,,Tất cả những động lực bạn cần để hoàn thành khóa học,Văn bản
,,,,,,,Câu chuyện của tôi: Tôi đã dừng việc học vẹt như thế nào,4:04
,,,,,,,Làm thế nào để nỗi đau và sự thất vọng của việc học vẹt kết thúc mãi mãi,Văn bản
,,,,,,,Điều kiện tiên quyết là bạn phải sẵn sàng trải nghiệm,2:55
,,,,,,,Luyện tập: Bạn có sẵn sàng trải nghiệm?,Văn bản
,,,,,,Phần 2: Phương pháp Bộ nhớ Từ tính có sơ đồ,,
,,,,,,,Cung điện trí nhớ là gì?,2:04
,,,,,,,Tại sao ta sử dụng Cung điện trí nhớ,1 trang
,,,,,,,Học cách làm chủ Cung điện trí nhớ và cách xây dựng đúng hướng,Văn bản
,,,,,,,Nguyên tắc Vị trí,4:45
,,,,,,,Học cách làm chủ nguyên tắc Vị trí ngay bây giờ,Văn bản
,,,,,,,Nguyên tắc Bảng chữ cái hóa,4:38
,,,,,,,Tổng hợp về các nguyên tắc Vị trí & Bảng chữ cái hóa,4:36
,,,,,,,Làm thế nào để sử dụng Nguyên tắc Bảng chữ cái hóa ngay bây giờ,Văn bản
,,,,,,,Nguyên tắc Tưởng tượng,4:44
,,,,,,,Nguyên tắc hành động,3:03
,,,,,,,"Làm thế nào để sử dụng các nguyên tắc của Tưởng tượng, Hình ảnh và Hành động ngay lập tức",Văn bản
,,,,,,,Công thức Ghi nhớ tối thượng,1:56
,,,,,,,Nguyên tắc chính của việc Tóm tắt,14 trang
,,,,,,,Kiểm tra về Các nguyên tắc chính,5 câu hỏi
,,,,,,,Ví dụ về ghi nhớ theo thứ tự bảng chữ cái: tiếng Hy Lạp,31:59:00
,,,,,,Phần 3: Thiết lập Cung điện trí nhớ từ vựng của bạn,,
,,,,,,,Chuẩn bị & xác định trước,6:56
,,,,,,,Bài kiểm tra về Chuẩn bị & định trước,1 câu hỏi
,,,,,,Phần 4: Ghi nhớ từ tính cho phần Ngữ pháp - Bài tập,,
,,,,,,,bài tập tải về,21 trang
,,,,,,,Những bài tập về Phòng Ghi nhỡ sẽ mang lại kết quả tuyệt vời khi bạn biết cách lấp đầy chúng,5:26
,,,,,,,Bài tập thực hành mẫu của 1 học viên theo phương pháp Bộ nhớ Từ tính,8 trang
,,,,,,Phần 5: Gài từ vựng vào Cung điện trí nhớ của bạ,,
,,,,,,,Nguyên tắc của phân loại từ vựng,1:59
,,,,,,,Bài kiểm tra về nguyên tắc của phân loại từ vựng,1 câu hỏi
,,,,,,,Bài tập: Chuẩn bị và Xác định,Văn bản
,,,,,,Phần 6: Bí quyết nhớ bài: Lưu trữ và kiểm tra từ vựng đã học,,
,,,,,,,Lập kế hoạch & luyện tập từ vựng đã học,6:03
,,,,,,,Sử dụng tệp Excel để lưu trữ và kiểm tra từ vựng đã ghi nhớ,13:14
,,,,,,,Nguyên tắc Từ ghép,8:29
,,,,,,,Tóm tắt bí quyết Nhớ lại,2 trang
,,,,,,,Bài kiểm tra Lưu trữ và luyện tập với từ vựng đã học,2 câu hỏi
,,,,,,Phần 7:Bí quyết ghi nhớ ngữ pháp này sẽ mang đến những trải nghiệm tuyệt vời với việc học ngoại ngữ cho bạn,,
,,,,,,,Làm thế nào để dễ dàng sử dụng Cung điện trí nhớ và Liên kết để nhỡ những cấu trúc ngữ pháp khác nhau,5 trang
,,,,,,Phần 8: Bí quyết xây dựng kế hoạch ghi nhớ từ vựng theo thữ tự bảng chữ cái,,
,,,,,,,Làm thế nào để học thuộc lòng từ vựng của nhiều hơn một ngoại ngữ cũng lúc,5:36
,,,,,,,Bí quyết để học thuộc lòng bảng chữ cái xa lạ,3:54
,,,,,,,Ví dụ về Cung điện trí nhớ xếp theo bảng chữ cái,7:08
,,,,,,,Nguồn tham khảo Phát âm tuyệt vời (và làm thế nào để sử dụng nó),4:11
,,,,,,,Bài kiểm tra về Bí quyết xây dựng chiến lược,2 câu hỏi
,,,,,,Phần 9: Các khái niệm nâng cao,,
,,,,,,,Làm thế nào để học thuộc lòng chính tả của từ vựng ngoại ngữ,3:40
,,,,,,,Sử dụng không gian tưởng tượng,5:10
,,,,,,,Nguyên tắc Đa dạng,1:31
,,,,,,,Nguyên tắc Thả lỏng tâm trí,8:20
,,,,,,,Bài kiểm tra về các khái niệm nâng cao,2 câu hỏi
,,,,,,Phần 10: Các bí quyết hàng đầu về việc ghi nhớ ngoại ngữ - bonus,,
,,,,,,,Tặng thêm bài 1,1:14:27
,,,,,,,Tặng thêm: bài 1 phụ lục: bản PDF đầy đủ của khóa học này,75 trang
,,,,,,,Tặng thêm bài 2,4:28
,,,,,,,Tặng thêm bài 3,21:21
,,,,,,,Tặng thêm bài 4,10:21:00
,,,,,,Phần 11: Phương pháp Bộ nhớ Từ tính- phần bổ sung,,
,,,,,,,Sử dụng trờ chơi điện tử để học thuộc lòng từ vựng,1:57
,,,,,,,Ghi nhớ từ vựng với những khu thương mai,3:26
,,,,,,,Tạo nên động lực,3:09
,,,,,,,Nhắm mắt lại để ghi nhớ,1:04
,,,,,,,Quản lý thời gian và ghi nhớ từ vựng,3:55
,,,,,,,Các rủi ro của sự cầu toàn,6:18
,,,,,, Phần 12: Phần phụ lục đặc biệt: Các chuyên gia trong việc học và ghi nhớ ngoại ngữ,,
,,,,,,,Làm thế nào để trở thành một Người học Siêu cấp với tuyệt vời giảng sư Jonathan Levi,58:31:00
,,,,,,Phần 13: Kết luận,,
,,,,,,,Giảm bớt chướng ngại,2:04
,,,,,,,Cám ơn bạn !,1:24
,,,,,,,Trước khi bạn đi,Văn bản
,,,,,,Phần 14: Câu hỏi được trả lời (nội dung vẫn cập nhật cho người mới tham gia khóa học),,
,,,,,,,Về việc không vượt qua con giới hạn của bạn khi sử dụng Cung điện trí nhớ để nhớ từ vựng,17:51
,,,,,,,Về việc trở nên trực quan hơn khi sử dụng Cung điện trí nhớ để nhớ từ vựng,22:54
,,,,,,,Về việc tìm thêm nhiều Cung điện trí nhớ.,23:18
,,,,,,,"Về việc dùng các ""Miếng dán"" trong đầu bạn nhằm ghi nhớ từ vựng",4:20
,,,,,,,Mở rộng khả năng ghi nhớ của bạn,11:56
,,,,,,,"Về ""Khung"" của sự thành thạo",17:08
,,,,,,,Về thủ thuật ghi nhớ theo phong cách Nữ hoàng Elizabeth,4:57
,,,,,,,Về việc định vị mục tiêu ngôn ngữ của bạn một cách chính xác trong Cung điện trí nhớ,6:48
,,,,,,,Về việc dùng thủ thuật Hình ảnh trong Cung điện trí nhớ,9:01
,,,,,,,"Hướng dẫn về việc tìm kiếm thời gian, tính nhất quán, và công nghệ trong học tiếng Tây Ban NHa",1:02
,,,,,,,"Hướng dẫn về việc di chuyển giữ đói tượng được ghi nhớ với từ vựng với phương pháp ""Blitzkrieg"" trong việc học tiengs Trung",14:17:00
,,,,,,,Khóa học đặc biệt về hướng dẫn ghi nhớ các thuật ngữ y tế khó,12:28
,,,,,,,Hướng dẫn đơn giản hóa Cung điện trí nhớ trong việc học tiếng Đức,1:05:06
,,,,,,,,1:05:06