Alias,Title,Subtitle,Description,Requirement,Benefit,Audience,Section,Lecture,Duration / format,Type,Link
marketing-lam-the-nao-de-tiep-thi-ban-than-nhu-mot-chuyen-gia,Marketing: Làm thế nào để tiếp thị bản thân như một chuyên gia?,"Tìm hiểu cách làm thế nào để kết hợp, tạo dấu ấn, tiếp thị, & bán dịch vụ của bạn để tạo ra sự hấp dẫn, lợi nhuận, và thành công cho việc kinh doanh",Mô tả về khóa học,Yêu cầu của khóa học,Lợi ích từ khóa học,Đối tượng mục tiêu,Phần 1: Giới thiệu,,,,
,,,"Tham gia cùng với 4.000 huấn luyện viên và chuyên gia tư vấn, những người đã học cách làm thế nào để marketing bản thân một cách hiệu quả hơn và khám phá lý do tại sao khóa học này đạt 66 đánh giá 5 sao.",Máy tính có kết nối Internet.,Hơn 29 Phần giảng và 4 giờ nội dung!,"Huấn luyện viên và tư vấn viên độc lập chưa đạt được mục tiêu kinh doanh của họ, hoặc những người không biết làm thế nào để marketing tốt nhất cho mình.",,Giới thiệu,10:11,Video,
,,,Khóa học dễ hiểu và toàn diện này cung cấp cho bạn mọi thứ bạn cần biết và thực hiện để thiết lập công việc huấn luyện độc lập hoặc tư vấn kinh doanh cho bản thân bạn nhằm đạt được thành công trong tương lai,"Phần mềm đọc PDF, chẳng hạn như Adobe Reader.",Khám phá thị trường phù hợp nhất cho bạn và doanh nghiệp của bạn,Những cá nhân đang xem xét việc bắt đầu sự nghiệp như một huấn luyện viên hoặc tư vấn viên độc lập và không chắc chắn làm thế nào để thiết lập việc kinh doanh hoặc marketing bản thân một cách hiệu quả.,Phần 2: Bước một: Tìm hiểu bản thân,,,,
,,,"Nếu bạn đang cố gắng để trở thành một huấn luyện viên hoặc chuyên gia tư vấn, xác định chuyên môn và marketing bản thân đúng cách là chìa khóa để tìm kiếm và duy trì khách hàng.","Kinh nghiệm, chuyên môn, đào tạo và / hoặc giấy chứng nhận đủ điều kiện rằng bạn là một huấn luyện viên hoặc tư vấn viên độc lập.",Xác định khách hàng lý tưởng của bạn để bạn biết chính xác bạn marketing cho AI,,,Giới thiệu bước 1,0:30,Video,
,,,"Khóa học này được thiết kế giúp bạn tìm thấy thị trường nghách cho riêng mình, xác định đúng đối tượng khách hàng và biết cách duy trì năng lực tài chính.",,"Biết các mô hình kinh doanh và chiến lược doanh thu tốt nhất , từ đó bạn có thể đạt được mục tiêu tài chính và mục tiêu sống của bạn",,,Hộp các công cụ,8:10,Video,
,,,"""Tôi đã tựkiếm được $3000 chỉ trong vòng một tháng tham gia lớp học của Debbie, mặc dù đây là một kiểu tư vấn hoàn toàn khác so với những gì tôi đã làm trong suốt 8 năm qua.""",,Trình bày dịch vụ của bạn để chúng phục vụ cho khách hàng và doanh nghiệp của bạn tốt nhất,,,Định hình Phong cách doanh nhân,14:43,Video,
,,,Đào tạo đột phá,,Phát triển thông điệp marketing cốt lõi của bạn giúp bạn biết chính xác những gì để nói nhằm thu hút khách hàng tốt nhất,,,Giá trị cốt lõi của bạn,6:46,Video,
,,,Bán chuyên môn của bạn và xây dựng việc kinh doanh của bạn bằng cách marketing bản thân hiệu quả,,Thiết kế một kế hoạch marketing linh hoạt để đạt được mục tiêu cụ thể của bạn,,Phần 3: Bước Hai: Tìm thị trường phù hợp với bạn,,,,
,,,Thể hiện dịch vụ của bạn nhằm khiến chúng hấp dẫn với khách hàng mới,,Phát triển các ý tưởng marketing hấp dẫn mà bạn có thể sử dụng trong tất cả các kế hoạch marketing để thu hút khách hàng hiệu quả,,,Giới thiệu bước 2,0:30,Video,
,,,Tìm ra thị trường nghách của bạn và loại bỏ các đối thủ cạnh tranh,,"Đưa ra một thương hiệu độc đáo và hấp dẫn mà bạn yêu thích, và thể hiện rằng bạn khác biệt với tất cả mọi người",,,Xác định khách hàng lý tưởng của bạn,8:33,Video,
,,,Tạo một thương hiệu mạnh để bạn nổi bật và được chú ý,,Biết bạn có một doanh nghiệp có khả năng về tài chính và hiểu chính xác những gì phải làm để đạt được mục tiêu tài chính của bạn,,,Khám phá những gì bạn đang thực sự bán,10:20,Video,
,,,Viết bản thảo marketing hợp lý nhằm thuyết phục khách hàng tiềm năng hành động,,Biết chính xác làm thế nào để xây dựng doanh nghiệp của bạn theo cách bạn sẽ thích nó,,"Phần 4: Bước ba: Thiết kế việc kinh doanh, Sản phẩm & Dịch vụ của bạn",,,,
,,,Xây dựng một kế hoạch marketing hiệu quả để thu hút khách hàng mới,,"Biết chính xác làm thế nào để việc kinh doanh, các chương trình, dịch vụ, thương hiệu, và thông điệp marketing kết nối và cộng hưởng với khách hàng lý tưởng, khiến vậy họ không thể chờ đợi để làm việc với bạn",,,Giới thiệu bước 3,0:30,Video,
,,,Bán dịch vụ của bạn một cách thoải mái và hiệu quả,,Có một hệ thống tân tiến nhất tại chỗ để thu hút khách hàng triển vọng cho doanh nghiệp của bạn,,,Chọn một mô hình kinh doanh,10:37,Video,
,,,Tận dụng những kinh nghiệm độc đáo của bạn vào công việc,,"Biết làm thế nào để bán hàng một cách thoải mái và hiệu quả, từ đó bạn có thể khiến khách hàng tiềm năng sẵn sàng chi trả",,,Thiết kế chương trình mang dấu ân của bạn,12:00,Video,
,,,"Sự bùng nổ trong ngành huấn luyện phong cách sống, huấn luyện - chăm sóc sức khỏe, và ngành công nghiệp tư vấn mang lại cho khách hàng nhiều sự lựa chọn hơn khi cần huấn luyện viên hoặc tư vấn viên.",,Biết làm thế nào để theo dõi và tinh chỉnh việc kinh doanh và marketing của bạn theo thời gian để nó tiếp tục làm việc càng ngày càng tốt hơn khi bạn còn đang kinh doanh,,,Làm một thử nghiệm về tính khả thi tài chính,10:23,Video,
,,,"Để tạo sự khác biệt, bạn cần một thương hiệu độc đáo và một sự hiện diện mạnh mẽ trên thị trường, từ đó bạn có thể thu hút đúng đối tượng khách hàng. Nếu bạn mới bắt đầu trong sự nghiệp huấn luyện hoặc tư vấn viên, khóa học này sẽ giúp bạn quảng cáo dịch vụ và thương hiệu của mình, từ đó làm doanh nghiệp của bạn hấp dẫn với các khách hàng tiềm năng.",,,,Phần 5: Bước Bốn: Tạo thông điệp marketing của bạn,,,,
,,,"Khóa học toàn diện này sẽ không chỉ dạy cho bạn những gì bạn cần làm để thể hiện mình là một huấn luyện viên hoặc chuyên gia tư vấn, nó cung cấp các bài tập đơn giản và hướng dẫn bạn từng bước.",,,,,Giới thiệu bước 4,0:30,Video,
,,,"Cho dù bạn mới bắt đầu, hoặc bạn đang muốn phát triển, bạn sẽ học được những cách hiệu quả nhất để thu hút và gắn kết với khách hàng tiềm năng cùng các khách hàng cũ, xây dựng danh sách email, tạo ra lời truyền miệng, và tạo ra một kế hoạch marketing thành công mang lại lợi nhuận kinh doanh.",,,,,Thông điệp marketing cốt lõi của bạn,13:59,Video,
,,,Nội dung và Tổng quan,,,,,Tầm quan trọng của việc tập trung,7:04,Video,
,,,"Khóa học này bắt đầu bằng việc xác định sự độc đáo, kỹ năng, kinh nghiệm và chuyên môn của bạn để giúp bạn xác địnhthị trường thích hợp cho doanh nghiệp của mình. Bạn sẽ xác định khách hàng lý tưởng của bạn và khám phá những gì bạn đang thực sự bán.",,,,Phần 6: Bước Năm: Xây dựng thương hiệu doanh nghiệp của bạn,,,,
,,,"Bạn sẽ tìm hiểu cách thiết kế các sản phẩm và dịch vụ, bao gồm cả việc chọn mô hình kinh doanh, thiết kế một chương trình mang dấu ấn riêng và thực hiện một Phần kiểm tra khả năng tài chính để đảm bảo rằng doanh nghiệp của bạn sẽ có lợi nhuận. Sau đó, bạn sẽ tạo ra một thông điệp marketing tập trung và một kế hoạch marketing theo ý khách hàng, rồi bạn sẽ xác định thương hiệu độc đáo và hấp dẫn của riêng mình.",,,,,Giới thiệu bước 5,0:31,Video,
,,,"Bởi lẽ thu hút khách hàng rất quan trọng cho sự thành công của bạn, khóa học này không chỉ tập trung vào việc tìm kiếm khách hàng tiềm năng mà còn làm thế nào để họ tham gia vào công việc làm ăn của bạn.",,,,,Khám phá về nhãn hiệu,14:28,Video,
,,,"Khóa học này sẽ giúp bạn xây dựng thương hiệu cá nhân của mình và phát triển kinh doanh với tư cách một nhà tư vấn hoặc huấn luyện viên. Sau khi tham gia khóa học này, bạn sẽ có thể marketing các kỹ năng và xác lập sự độc đáo của mình với những người khác. Bạn là duy nhất và khóa học này sẽ giúp bạn quảng bá những tài năng độc đáo của mình nhằm giúp doanh nghiệp của bạn có thể thành công.",,,,,Động não về nhãn hiệu,6:03,Video,
,,,,,,,,Nghiên cứu và Bảo vệ thương hiệu,10:40,Video,
,,,,,,,,Hoàn hiện thương hiệu,10:07,Video,
,,,,,,,Mục 7: Bước Sáu: Thiết lập kế hoạch tiếp thị của bạn,,,,
,,,,,,,,Giới thiệu bước 6,0:29,Video,
,,,,,,,,Lựa chọn các hoạt động marketing của bạn,7:56,Video,
,,,,,,,,Lập sơ đồ kế hoạch marketing trong 90 ngày của bạn,10:19,Video,
,,,,,,,Phần 8: Bước Bảy: Thu hút Khách hàng,,,,
,,,,,,,,Giới thiệu bước 7,0:31,Video,
,,,,,,,,Thu hút khách hàng: Tìm kiếm khách hàng triển vọng cho doanh nghiệp của bạn,12:56,Video,
,,,,,,,,Gắn kết: Thúc đẩy khách hàng tiềm năng hành động,10:25,Video,
,,,,,,,,Phát triển: Xây dựng một mối quan hệ với khách hàng tiềm năng của bạn,14:04,Video,
,,,,,,,,Chinh phục thành công: Biến khách hàng tiềm năng thành khách hàng chịu thanh toán,16:36,Video,
,,,,,,,Phần 9: Kết luận,,,,
,,,,,,,,Tóm tắt và Tổng kết,4:02,Video,