Name,sub-title,Mô tả khóa học,Yêu cầu,Lợi ích từ khóa học,Đối tượng mục tiêu,Chương trình giảng dạy,
"Bí quyết đi du lịch - Du lịch rẻ, thông minh và vui vẻ","Một gói học với hơn 60 video cung cấp những chiến thuật vững chắc để tiết kiệm tiền, giúp cho bạn du lịch an toàn và trở thành một khách du lịch thông minh","hơn 23500 người tham gia khóa học của tôi
Được cung cấp bởi một trong những giáo viên xuất sắc nhất ở Udemy
hơn 420 review từ những sinh viên hài lòng
video thêm vào tháng 7/2015. trong khóa này tôi sẽ chia sẻ với bạn những gì cần học để có thể du lịch được 45 nước khác nhau. Chúng ta sẽ bàn tới không chỉ những chuyến du lịch thông thường mà còn chia sẽ cho bạn những mẹo đặc biệt bao gồm: tiết kiệm chi phí lưu trú, an toàn ở nước ngoài, xây dựng động lực và xóa tan nối sợ vô hình, mặc cả với người bán hàng , kết bạn với người nước ngoài và còn nhiều hơn thế nữa. Tôi là tác giả của 6 khóa học thành công tại Udemy. làm việc trong 1 khóa học khiến tôi có được một kinh nghiệm tuyệt vời. Tôi áp dụng những bài học ấy trong khóa học về ""bí quyết đi du lịch"" - khóa học tốt nhất về du lịch trên thị trường.
Học viên nói gì về khóa học
khóa học tuyệt vời, thực sự tót và nhiều thông tin bổ ích. đặc biệt về phần du lịch an toàn
Khóa học này thật tuyệt vời và có rất nhiều lời khuyên thực tế, trước khi tham gia khóa học này tôi không tự tin về những chuyến du lịch và thường có những quan niệm sai lầm về nó. tôi được Jimmy tẩy não hoàn toàn. và giờ đây tôi rất thích du lịch. cảm ơn Jimmy - Nigash Nạim nói
khóa học Rất hữu ích, tôi sẽ giới thiệu nó với mọi người, những người muốn ra nước ngoài và khám phá những đất nước khác và những nền văn hóa trên thế giới. Khóa học sẽ thành công, chắc chắn tôi sẽ học khóa học khác của Jimmy - sergey
khóa học về du lịch tuyệt vời, khóa tốt nhất tôi từng mua. thật tốt cho người mới bắt đầu. cảm ơn rất nhiều. Elay Elay
Tuyệt vời, học khóa học của anh ấy như việc xem show diễn truyền hình. rất vui, sự tương tác luôn đi cùng học tập. cảm ơn Jimmy Kirill Erêmnko chia sể
Jimmy đã giúp chú ta chú ý về những điều cực kỳ đơn giản nhưng quan trọng mà chúng ta vẫn thường cho là hiển nhiên. Ông cũng giải thích chi tiết và rõ ràng về những ảnh hưởng của việc sử dụng hoặc không sử dụng những phương pháp của ông ấy.",Tư duy cởi mở,"hơn 89 bài học và 5 giờ giảng dạy
Tận hưởng những video chất lượng cao từ khắp nơi trên Thế giới
chiến lược luyện tập, kỹ thuật và cách thức
Cập nhật liên tục với ít nhât 4 thương hiệu video mới mỗi thang
chiên lược cắt giảm chi phí của bạn
học cách dặt 1 vé máy bay giá rẻ
làm sao để giữ bản thân và gia đình an toàn
xóa bỏ những sợ hãi khi đi du lịch
làm sao để du lịch 1 mình
làm sao để kiếm bạn bè nước ngoài
mặc cả với người bán hang
và nhiều thứ hơn nữa","Bất cứ ai muốn học cách đi du lịch vui vẻ và thông minh mà không phải chi một khoản tiền quá lớn. Hãy luôn nhớ rằng tôi đã thiết kế nội dung cho những mới hoặc thỉng thoảng mới đi du lịch. Nếu bạn là một khách du lịch có kinh nghiệm, có thể bạn vẫn sẽ tìm được những thông tin hữu ích. Tin tốt là vào tháng 7 năm 2015, tôi sẽ cập nhật nhiều video chi tiết được thiết kế đặc biệt cho những ""phượt thủ"" giàu kinh nghiệm.",Phần 1: giới thiệu,
,,,,,,,Video xem trước.
,,,,,,Phần 2: Du lịch an toàn,
,,,,,,,Giới thiệu về du lịch an toàn
,,,,,,,Cách tốt nhất để học về sự an toàn
,,,,,,,Làm sao để không cần dùng đến bản đồ
,,,,,,,làm sao để có thể bảo vệ bạn
,,,,,,,Những điều cần nhớ khi rời khách sạn
,,,,,,,Cụm từ bạn nên thuộc lòng đến hoàn hảo
,,,,,,,sức mạnh của Pocket bí mật
,,,,,,,Đi bộ tự tin và cảm giác phương hướng
,,,,,,,Hướng dẫn bạn bè của bạn
,,,,,,,Tại sao nên để 1 bức ảnh trong túi
,,,,,,,Đừng giữ nhiều đồ giá trị ở 1 ch
,,,,,,,"Thuốc, số điện thoại khẩn cấp, bảo hiểm"
,,,,,,,Vị trí an toàn đặc biêt
,,,,,,,Các trò gian lận thường gặp
,,,,,,,Có 1 sự quan sát tốt
,,,,,,Phần 3: du lịch giá rẻ - chi phí thâp,
,,,,,,,Không đủ tiền? Sức mạnh của việc thay đổi thói quen chi tiêu.
,,,,,,,Làm sao để có thể kiếm được nhà trọ miễn phí mọi nơi
,,,,,,,Làm sao để kiếm được tiền trên chuyến đi
,,,,,,,Bắt chước dân địa phương để giảm chi phí
,,,,,,,Giới thiệu về du lịch trái mùa
,,,,,,,Điều gì tạo nên việc du lịch trái mùa thú vi
,,,,,,,Giảm giá lớn
,,,,,,,Dòng kẻ
,,,,,,Phần 4: Lời khuyên và nhắn nhủ,
,,,,,,,Làm sao để được chữa bệnh miễn phí
,,,,,,,1 điều luôn nhớ về  nhà nghỉ
,,,,,,,Lời khuyên về chuyến đi trong ngày
,,,,,,,Làm sao để tìm được bãi biển đẹp nhất
,,,,,,,Tại sao tôi thích sân bay
,,,,,,,Đường băng ở sân bay
,,,,,,,Lên ngân sách 
,,,,,,Phần 5: Đặt vé máy bay giá vẻ,
,,,,,,,Giới thiệu về máy bay giá rẻ
,,,,,,,2 vé rẻ hơn 1?
,,,,,,,Làm thẻ thành viên
,,,,,,,Chuyến bay xuyên lục địa
,,,,,,,Tính nhât quán
,,,,,,,Ví dụ về máy bay giá rẻ
,,,,,,,Máy bay giá rẻ ví dụ trong PDF
,,,,,,Phần 6: tạo động lực và cài đặt tư duy,
,,,,,,,Giới thiệu - tạo động lực và cài đặt tư duy
,,,,,,,Tại sao đi giúp lịch khiến bạn trở nên tốt hơn?
,,,,,,,Du lịch làm cho bạn đổi mới chính mình
,,,,,,,Làm sao để có thái độ tích cực
,,,,,,,Học từ các địa điểm du lịch
,,,,,,Phần 7: xóa tan sự sợ hãi và quan niệm sai lầm,
,,,,,,,Giới thiệu về xóa tán ự sợ hãi và quan niệm sai lầm
,,,,,,,"Đi du lịch rất nguy hiểm, có thật vậy không?"
,,,,,,,Sự nguy hiểm trong nhận thức và Sự nguy hiểm trong thực tế
,,,,,,,Sự thật về những người ở các quốc gia đang phát triển
,,,,,,,Tôi không thể du lịch vì có quá nhiều công việc
,,,,,,Phần 8: du lịch 1 mình,
,,,,,,,Giới thiệu về du lịch một mình
,,,,,,,Cảm thấy cô độc
,,,,,,,Làm sao để con gái có thể du lịch 1 mình
,,,,,,,Mẹo đối với nữ du khách
,,,,,,,Làm sao để kiếm bạn trên bãi biển
,,,,,,Phần 9: kết bạn với người nước ngoài và tăng nhanh các mối quan hệ xã hội,
,,,,,,,Học những cụm từ đơn giản
,,,,,,,Bạn cần nói gì và nói như thế nào
,,,,,,,Làm sao để khiến họ cảm thấy đặc biệt
,,,,,,,Lời khuyên thú vị cho những hành khach sức khỏe yếu
,,,,,,Phần 10: Bonus: Mặc cả với những người bán hàng ở chợ trời,
,,,,,,,Giới thiệu
,,,,,,,Đừng thể hiện quá nhiều sự thích thú
,,,,,,,Sức mạnh của sự quan sát
,,,,,,,Cho họ nhìn thấy tiền
,,,,,,,"Cảnh sát tốt, xấu"
,,,,,,,Trước khi bạn nhìn vào thẻ giá
,,,,,,,Cái gì và Có thể
,,,,,,Phần 11: Hỏi đáp,
,,,,,,,Giới thiệu
,,,,,,,Tài nguyên miễn phí khác bạn có thể sử dụng
,,,,,,,Cảm ơn
,,,,,,,bài 12: Tặng thêm: phiên bản AUDIO cho MP3/Ipod
,,,,,,,Làm sao để tìm được bãi biển tốt nhất
,,,,,,,Nói những câu như người bản xứ nói như thế nào
,,,,,,,Lập ngân sách như thế nào
,,,,,,,Kiêm tiền trên thế giới
,,,,,,,Đặt vé máy bay giá rẻ
,,,,,,,2 vé rẻ hơn 1?
,,,,,,,Lời khuyên cho chuyến du lịch trong ngày
,,,,,,,Những điều cần nhớ khi rời khách sạn
,,,,,,,Cảm thấy cô độc
,,,,,,,Vài câu nói khiến bạn an toàn
,,,,,,,Làm thẻ thành viên
,,,,,,,Làm sao để được chữa bệnh miến phí
,,,,,,,Xây dựng quan hệ với người dân địa phương
,,,,,,,Tiền có thể giúp bạn an toàn như thế nào
,,,,,,,"Tôi là nữ du khách, làm sao để tôi được an toàn\\"
,,,,,,,Làm sao để làm quen được người khác trên bãi biển
,,,,,,,Du lịch trái mùa - chi phí thấp
,,,,,,,An toàn - đừng giữ quá nhiều đồ giá trị tại 1 chỗ
,,,,,,,Sức mạnh của túi bí mật
,,,,,,,"Đi du lịch rất nguy hiểm, có thật vậy không?"
,,,,,,,Làm thế nào để không cần dùng đến bản đồ - du lịch an toàn
,,,,,,,Tại sao du lịch trái mùa có thể rất tuyệt