Alias,Title,Subtitle,Description,Requirement,Benefit,Audience,Section,Lecture,Duration / format,Type,Link
su-dung-youtube-de-xep-hang-1-tren-google-chi-trong-choc-lat-youtube-cho-doanh-nghiep,Sử dụng Youtube để Xếp hạng 1 trên Google chỉ trong chốc lát: Youtube cho Doanh nghiệp,Các Video Youtube đơn giản đem về bộn tiền mỗi tháng - Sử dụng các Video YouTube để quảng cáo Doanh nghiệp và làm tăng thu nhập của bạn một cách nhanh chóng!,Mô tả về khóa học,Yêu cầu của khóa học,Lợi ích từ khóa học,Đối tượng mục tiêu,,Chào mừng và Giới thiệu,4:11,Video,
,,,"Tham gia cùng với HƠN 6,700 học sinh khác để thúc đẩy sự thành công bằng khóa học bán chạy nhất này",Bạn phải có mong muốn cháy bỏng để đưa sản phẩm hoặc website của bạn lên Trang 1 của Google.,Hơn 23 bài giảng và 2 giờ nội dung!,Những doanh nhân mới khởi nghiệp,,Giới thiệu về sự Phản hồi và Đánh giá về khóa học,4:07,Video,
,,,Bạn muốn biết những video trên YouTube NHẢY lên top đầu khi bạn tìm kiếm trên Google không? Tôi sẽ chỉ cho bạn cách tạo ra các video cho doanh nghiệp hoặc sản phẩm của bạn một cách nhanh chóng và dễ dàng để thực hiện điều này ... chỉ trong chốc lát!,Bạn cần bổ sung một nguồn năng lượng dồi dào; đây là một chiến lược thực hành.,Học về mối quan hệ giữa Google và YouTube - và cách nó ảnh hưởng đến bạn.,Chủ doanh nghiệp nhỏ,"Phần 1: ""Công thức"" và Tại sao nó hiệu quả",,,,
,,,Đảm bảo: Theo dõi khóa học này và bạn SẼ xếp hạng top đầu của trang Google!,Thứ duy nhất bạn cần biết là về sản phẩm của bạn. Đó là thứ duy nhất bạn tôi sẽ không dạy.,Biết được các Từ khóa là gì và giá trị của chúng trong việc tối ưu hóa web video.,Chuyên gia E- Marketing,,Tìm ra rồi! YouTube + Google = SEO4Video ,5:16,Video,
,,,Được cập nhật liên tục và Được làm phong phú với các Phần Giảng và Tài liệu mới,,Học cách xác định các loại video được Google ưa thích,Người bán hàng,,Google & YouTube (and TÔI)! … Một câu chuyện tình yêu,5:55,Video,
,,,"63 LƯỢT ĐÁNH GIÁ, KHÔNG THỂ SAI LẦM ĐƯỢC!",,Học cách lập một video doanh nghiệp thành công.,Quản lý bán hàng,,"Đèn, Máy ảnh, Hành động",6:28,Video,
,,,Những Đánh giá Gần đây:,,Học cách tạo ra các tiêu đề và kịch bản hay nhất cho các video của bạn.,Quản lý Marketing,,Hãy chắc chắn rằng Chúng ta hiểu rõ các Khái niệm cơ bản...,3 câu hỏi,Quiz,
,,,"""Khóa học tối ưu nhất về YouTube!""",,Học cách hay nhất trong việc thiết lập kênh YouTube của bạn.,,Phần 2: Nghiên cứu và Tiền sản xuất,,,,
,,,"Tôi đã học một số khóa học khác về YouTube trên trang web này. Không gì có thể so sánh được. Robert đi đúng trọng tâm, với kỹ thuật và các bí quyết đã được chứng minh và có thể hiện thực hóa - được giảng dạy theo một phương thức KHÔNG HÀN LÂM. Nó đã giúp cải thiện xếp hạng của tôi trên Google một cách đáng kể!",,Học cách chuyển đổi trực tiếp khách hàng tiềm năng từ video đến trang web của bạn.,,,Khai thác các Từ khóa -  Một phi vụ kiếm bộn tiền,5:24,Video,
,,,"""Tuyệt vời!",,"Học chính xác cách đưa Google thứ mà họ muốn, từ đó họ sẽ xếp loại video của bạn lên hạng 1.",,,Các công cụ tiềm năng - Làm việc với công cụ tìm kiếm từ khóa tự do của Google,4:12,Video,
,,,"Tôi đã có một video trong quá trình chuẩn bị đăng lên và tôi đã hoàn thiện nó bằng sự hướng dẫn của khóa học. Video này xếp vị trí thứ 8 trên Google trong vòng 12 giờ tải lên mà không có cách thức khác ngoài những điều được phác thảo trong khóa học. Khóa học tuyệt vời, cảm ơn bạn!",,,,,Các Công cụ Nghiên cứu Từ khóa khác,5:24,Video,
,,,Bạn đã biết chưa? Các nghiên cứu chỉ ra rằng việc video lên trang đầu của Google search dễ dàng hơn 50 lần so với website - đối với từ khóa giống nhau! Một phát hiện thú vị trong tiếp thị trên các mạng xã hội.,,,,,Tầm quan trọng của Từ khóa,2 câu hỏi,,
,,,"Và chỉ cần nghĩ về việc một video sản phầm, một dịch vụ kiểm tra từ đầu đến cuối, hoặc một cuộc phỏng vấn khép kín có giá trị thế nào, cuốn hút thế nào đối với thương hiệu của bạn...được chứng minh bằng sự thật là HẦU HẾT các bạn sẽ không bao giờ thực sự đọc câu này thậm chí khi nó đã được gạch chân. Hầu hết mọi người chỉ đọc lướt điều này sau đó xem VIDEO giới thiệu bên trên",,,,,The Dirty 2 Dozen - Phát triển Danh sách ban đầu của bạn,7:04,Video,
,,,Chỉ cần nghe các kết quả mà các học viên khác đã đạt trong khóa học này:,,,,,Kịch bản hoàn hảo: Một món Sanwich Video ngon,8:51,Video,
,,,"Bạn tôi KHÔNG CÓ kinh nghiệm nào về YouTube, và thậm chí website của anh ấy không được xếp hạng trên Google...sau đó anh đã sử dụng các chiến lược của tôi để đẩy website lên Trang 1 của Google 11 giờ sau khi đăng tải video đầu tiên của anh ấy. Thật vậy, chỉ trong chốc lát! anh ấy đã "" Thoát ra khỏi internet...nó thật là phí tiền,"" cho đến khi anh ta tham gia khóa học này. Trong vòng vài ngày, các video YouTube về doanh nghiệp của ban tôi đã được quảng cáo trên Trang 1 của Google.",,,,,Tùy chỉnh kênh YouTube của bạn: Không bao giờ quá sớm để Tối ưu hóa,9:55,Video,
,,,Sự thật: Marketing trên YouTube là thế hệ tiếp theo của marketing nội dung.,,,,Phần 3: Đến lúc đăng tải video,,,,
,,,Trong khóa học này tôi sẽ dạy bạn các phương thức đã:,,,,,Tải lên và Tối ưu hóa: Đồng hồ I$ đang điểm,4:59,Video,
,,,"Giúp các video của doanh nghiệp được xếp hạng trong nhiều ngành công nghiệp, từ nha khoa đến đồ trang sức đến dọn dẹp bể bơi",,,,,Sử dụng phần Mô tả của Youtube một cách hiệu quả nhất,6:32,Video,
,,,Cho phép các cá nhân và các doanh nghiệp sinh lời hàng nghìn đô la từ những video youtube dễ dàng nhanh chóng này,,,,,Nói thêm về Hộp thoại Mô tả của YouTube: Giúp người xem định hướng video của bạn,3:10,Video,
,,,Nhận được vô số người bắt đầuTỪ SỐ KHÔNG trên YouTube,,,,,Bí mật đằng sau công cụ phụ đề của YouTube,6:24,Video,
,,,Sinh lời thu nhập của CHÍNH tôi và ...từ youtube,,,,,Chúc mừng ... Bạn GẦN NHƯ đã hoàn thành!,5:00,Video,
,,,"Khóa học này là khóa học từ A đến Z trình bày chi tiết mỗi yếu tố của tiến trình để xếp hạng 1. Thậm chí nếu bạn chưa bao giờ đăng một video nào lên Youtube, hoặc thậm chí chưa bao giờ nghe gì về ""video marketing"", chúng tôi sẽ giúp bạn bắt đầu và thành công nhanh chóng.",,,,,Đặc biệt: Về hệ thống Call-to-action Overlay của Youtube,9:04,Video,
,,,Bạn sẽ học ....,,,,Phần 4: Thảo luận thêm,,,,
,,,Các kỹ thuật tìm kiếm từ khóa nâng cao,,,,,Liên kết hỗ trợ (Backlinking),9:16,Video,
,,,"Chính xác các cách tạo ra mỗi video, chủ đề và nội dung",,,,,Tối ưu hóa Video và Marketing Affiliate ,6:44,Video,
,,,Cách tối ưu để đưa video của bạn lên trang 1 của Google trong chính xác một đêm,,,,,Thêm bằng chứng về độ hiệu quả: YouTube + Google = SEO4Video,5:50,Video,
,,,Cách để làm cho những video và xếp hạng của bạn sinh ra lợi nhuận,,,,,"Hãy coi chừng - Hệ thống Overlay của Youtube đã Thay đổi!
Xem trước",4:18,Video,
,,,Khóa học này dành cho ai.,,,,,Và tốt hơn thế! Thêm Bài học hay vào tháng Tư năm 2015,2:54,Video,
,,,"Các bác sĩ, luật sư, môi giới, họa sĩ, những người trồng cây cảnh, tư vấn, các nhà doanh nghiệp ... doanh nghiệp bất kỳ dang cố gắng để tiếp thị một sản phẩm hoặc dịch vụ trực tuyến phải bắt đầu ngay bây giờ để có được một vị trí cạnh tranh, trước khi bị người khác đánh bại!",,,,,"Tiền Thưởng đặc biệt trị giá gần 1,400 đô la",Văn bản,,
,,,"Ngày nay, chỉ có 25% doanh nghiệp có trang web sử dụng video marketing trong các chiến dịch marketing trực tuyến của họ. Marketing trên YouTube là một trong những bí mật được giữ kín tốt nhất trong thời đại này. Tuy nhiên, bí mật đã bắt đầu lộ ra, vì vậy bạn nên hành động thật nhanh chóng.",,,,,,,,
,,,"NGAY BÂY GIỜ: Bạn có thể được xếp hạng qua một đêm, tuy nhiên do Youtube đang phát triển, điều này không phải trường hợp tốt nhất. YouTube đã lên tới 50 TỈ LƯỢT XEM mỗi ngày... và đây mới chỉ là điểm bắt đầu!",,,,,,,,
,,,"Khóa học này đưa đến cho bạn một tiến trình rõ ràng, khả thi để bắt đầu NGAY BÂY GIỜ. Vì thế đăng ký ngay hôm nay và hãy cùng khởi động để có được một số kết quả bạn đầu. Trở thành một chuyên gia marketing trên mạng xã hội.",,,,,,,,