Alias,Title,Subtitle,Description,Requirement,Benefit,Audience,Section,Lecture,Duration / format,Type,Link
bi-quyet-de-tang-so-luong-cac-cuoc-phong-van-xin-viec-cua-ban,Bí quyết để tăng số lượng các cuộc phỏng vấn xin việc của bạn,"Vào 2015, có được 3 - 6 cuộc phỏng vấn trong một tuần là việc khá dễ dàng nếu bạn sử dụng Linkedln để vượt qua ban tuyển dụng và nộp đơn trực tiếp cho quản lý tuyển dụng",Mô tả về khóa học,Yêu cầu của khóa học,Lợi ích từ khóa học,Đối tượng mục tiêu,"Phần 1: Làm thế nào để có một bản lý lịch nghề nghiệp đẹp, gây được sự chú ý",,,,
,,,Khóa học được cập nhật đầy đủ vào 6/3/2015,Học viên cần phải có tình thần sẵn sàng học hỏi và cảm thấy thoải mái khi sử dụng Linkedln,- Có 3 - 6 cuộc phỏng vấn mỗi tuần cùng với sự thoải mái và tự tin,- Khóa học này dành cho bất cứ ai đang tìm kiếm một công việc,,Làm sao để theo dõi được những video với chất lượng tốt nhất,Văn bản,Text,
,,,"Năm 2015, có việc làm chưa bao giờ lại dễ dàng hơn thế, và tôi ở đây để chỉ cho các bạn làm thế nào để có được từ 3 tới 6 cuộc phỏng vấn trong một tuần",,"- Và một cuộc phỏng vấn ở bất cứ công ty nào bạn muốn, bất cứ công ty nào",- Khóa học này dành cho bất cứ ai đang gặp khó khăn với việc có được 3-6 cuộc phỏng vấn trên tuần,,"Chào đón bạn đến với khóa học, đây là những gì chúng ta sẽ học",2:29,Video,
,,,Hầu hết mọi người tìm kiếm việc làm bằng cách nộp đơn qua mạng - cách tệ nhất có thể để kiếm tìm một công việc. Nhưng đó là tất cả những gì mọi người biết bởi vì đơn giản là chúng ra không bao giờ được dạy cách những tay săn việc hàng đầu tìm kiếm việc làm như thế nào.,,,,,Lý lịch nghề nghiệp nghiệp dư,0:54,Video,
,,,"Sau khi tôi tốt nghiệp đại học, tôi không thể tin được rằng kiếm việc lại khó khăn đến như thế. Tôi dành hàng giờ đồng hồ mỗi ngày để nộp đơn xin việc, viết mail, chỉnh thư giới thiệu và chả có mấy kết quả.",,,,,Lý lịch nghề nghiệp cơ bản thông thường,0:38,Video,
,,,"Nhưng sau khi một người quen nói với tôi một điều tuyệt vời ""người tìm được những công việc tốt nhất không nhất thiết là người thông minh nhất, có bằng cấp tốt nhất, họ là những người biết săn việc như thế nào thì có kết quả tốt nhất"" Họ đã đúng, và câu nói đó đã hoàn toàn thay đổi cuộc đời tôi",,,,,Lý lịch nghề nghiệp chuyên nghiệp,2:42,Video,
,,,"Tôi dành nhiều năm trong mảng tuyển dụng và nhân sự, làm việc với những tư vấn nghề nghiệp giỏi nhất, đọc tất cả những cuốn sách nổi tiếng về tìm kiếm việc làm và nghiên cứu mọi thứ tôi có thể tìm được. Tôi phát triển một vài chiến lược tìm việc độc đáo tuyệt vời và chúng hoạt động khá tốt, nhưng một chiến lược đặc biệt có kết quả bất ngờ. Hầu hết học viên từng làm việc với tôi, dù có nền tảng như thế nào đi chăng nữa, đều có thể thực hiện 3- 6 cuộc phỏng vấn trong vòng 72 giờ nếu như họ làm theo các bước trong chiến lược này.",,,,,Cách làm dễ đến kinh ngạc để có một bản sơ yếu lý lịch chuyên nghiệp,Văn bản,Text,
,,,Toàn bộ khóa học này về chiến lược tìm kiếm việc làm có những kết quả đáng kinh ngạc,,,,,Những vấn đề và giải pháp thay thế để có một bản sơ yếu lý lịch chuyên nghiệp,2:58,Video,
,,,"Nó liên quan đến việc vượt qua vòng sơ loại, tạo ra ấn tượng mạnh mẽ đầu tiên bằng việc sử dụng các thiết bị số đa dạng và nộp đơn trực tiếp tới người chịu trách nhiệm tuyển dụng",,,,,Một số các nguồn tham khảo hỗ trợ bạn,Văn bản,Text,
,,,"Bạn sẽ được tham gia 3 - 6 cuộc phỏng vấn một tuần sau khi bạn tham gia khóa học này, đơn giản là bạn sẽ không thể thất bại vì nó thực sự rất đơn giản và hiệu quả. Để đảm bảo sự thành công của bạn, tôi ở đây vì bạn, bạn không phải thực hiện nó một mình. Mua khóa học này và tôi sẽ đưa bạn số điện thoại của tôi để bạn có thể gọi nói chuyện với tôi bất cứ lúc nào. Bạn cũng có thể gửi email cho tôi và tôi sẽ trả lời mail của bạn trong vòng 24 tiếng hoặc chúng ta có thể thiết lập một ứng dụng gọi video qua Google Hangouts",,,,Phần 2: Làm một hồ sơ Linkedln ấn tượng tạo ấn tượng đầu tiên mạnh mẽ ,,,,
,,,"Tôi dành ra 30 tiếng một tuần để trả lời email và nói chuyện điện thoại với học sinh của mình. Tôi giúp đỡ mọi người cùng với kiến thức chuyên môn của mình và tạo ra khác biệt. Tôi yêu thích những gì tôi làm và tôi sẽ làm mọi thứ có thể, tôi trao cho các bạn mọi thứ tôi có để đảm bảo các bạn sẽ thành công.",,,,,Kết bạn với tôi trên Linkedln để có thêm sự hỗ trợ và cơ hội việc làm,Văn bản,Text,
,,,Chúc bạn có một ngày tuyệt vời,,,,,Có được hơn 500 sự liên kết trong vòng chưa đầy 5 phút,3:16,Video,
,,,,,,,,Hỏi đáp - có được hơn 500 liên kết trong vòng chưa đầy 5 phút,Văn bản,Text,
,,,,,,,,Nhưng gợi ý tối quan trọng của Linkedln và làm sao để có chúng,4:02,Video,
,,,,,,,,Làm thế nào để tạo ra những kỹ năng và phần xác nhận tuyệt vời,0:46,Video,
,,,,,,,,"Tiêu đề của bạn như một đoạn quảng cáo tới người tuyển dụng, đừng lãng phí khoảng trống đó",Văn bản,Text,
,,,,,,,,Những lời khuyên về hình ảnh của bạn trên Linkedln,Văn bản,Text,
,,,,,,,Phần 3: Làm thế nào để tách biệt bạn với những người khác và nổi bật với một trang cá nhân,,,,
,,,,,,,,Công cụ tuyệt vời nhất không thể chối cãi để bạn được tách biệt và nổi bật,3:08,Video,
,,,,,,,,95% mọi người không biết làm thế nào để sử dụng trang web cá nhân để có được một cuộc phỏng vấn,1:57,Video,
,,,,,,,,Cách không thể đơn giản hơn tạo ra một trang web cá nhân của bạn trong vòng 1 giờ đồng hồ,Văn bản,Text,
,,,,,,,Phần 4: Vượt qua vòng loại và chinh phục quá trình nộp đơn trực tuyến,,,,
,,,,,,,,Bí mật lớn nhất của tìm kiếm việc làm mà bạn không biết phần 1,2:05,Video,
,,,,,,,,Bí mật lớn nhất của tìm kiếm việc làm mà bạn không biết phần 2,3:09,Video,
,,,,,,,,Bí mật lớn nhất của tìm kiếm việc làm mà bạn không biết phần 3,1:52,Video,
,,,,,,,Phần 5: Hàng loạt các cách tiếp cận với quản lý nhân sự và áp dụng trực tiếp với mọi người,,,,
,,,,,,,,Tìm kiếm người ra quyết định tuyển dụng cuối cùng - tìm kiếm ông chủ của bạn,3:15,Video,
,,,,,,,,Nộp đơn trực tiếp mà không cần phải nói chuyện với bất cứ ai,1:50,Video,
,,,,,,,,"Đây là cách những người kiếm việc hàng đầu tìm kiếm những công việc tuyệt vời. Shhh, đây là một bí mật",4:03,Video,
,,,,,,,,"Không thể tìm thấy được ai là người ra quyết định cuối cùng? Đây là cách "" chữa cháy "" dễ dàng.",4:06,Video,
,,,,,,,,Tháp tìm việc và hệ thống giới thiệu nhân viên ,3:49,Video,
,,,,,,,,Phương pháp đơn giản nhất đôi khi có thể là cách tốt nhất,Văn bản,Text,
,,,,,,,,Bạn đã bao giờ kêu gọi sự hỗ trợ từ khách hàng? Một các khác để tiếp cận những người ra quyết định,2:20,Video,
,,,,,,,,Làm thế nào để có được Email của bất kỳ nhà tuyển dụng nào,Văn bản,Text,
,,,,,,,,Sử dụng phương tiện truyền thông đại chúng để nộp đơn trực tiếp,2:24,Video,
,,,,,,,Phần 6: Kết luận và các bước hành động,,,,
,,,,,,,,Gọi hoặc gửi mail cho tôi - Số điện thoại cá nhân và địa chỉ Email của tôi,Văn bản,Text,
,,,,,,,,Kế hoạch hành động,Văn bản,Text,
,,,,,,,,Một điều cuối cùng,2:44,Video,