,,Mô tả khóa học,Yêu cầu,Lợi ích từ khóa học,Đối tượng mục tiêu,Chương trình giảng dạy,,
PPC (Pay-Per-Click) với Google Adwords + Quảng cáo Facebook + Quảng cáo YouTube,"Học cách quảng PPC cáo trên google adwords, quảng cáo facebook, Youtube, twitter, linkedln và mMedia trả giá theo lượt click vào quảng cáo","Tìm hiểu về việc trả tiền theo mỗi click vào quảng cáo trở nên dễ dàng hơn khi bạn tham gia khóa học này
làm sao để sử dụng Google Adwords PPC để chuyển đối khách hàng với những chiến dịch quảng cáo bán hàng online
Tìm ra chiến lược tốt nhất để nhanh chóng tạo quảng cáo thành công trên FB để có tối đa lượt tương tác trên Phần post và giảm giá click chuyển đổi sang website
Khám phá ra nền tảng mới nơi bạn có thể hiển thị quảng cáo để tằng hiệu quả chiến dịch marketing trên Youtube, Twitter, Linkedln, và các thiết bị di động.
Sau khi quản lý được hàng tỷ quảng cáo online ấn tượng từ năm 2012, bạn có thể tin tưởng mỗi khóa học ở Udemy đều giúp việc học online nhanh hơn, thúc đẩy việc kinh doanh của bạn, và cải thiện việc tìm ra những chiến lược tốt cho sự thành công của quảng cáo trả tiền cho mỗi lượt click chuột trực tuyến. 
Hành động theo cảm xúc của bạn về Tình yêu, Hy vọng, Niềm tin để tham gia vào khóa học này ngay bây giờ.","Giới thiệu những kiến thức về những nguyên tắc quảng cáo và marketing.
Những khái niệm marketing cơ bản như nhấp chuột thông qua tỷ lệ, sự ấn tượng và chuyển đổi.","Hơn 30 Phần giảng với 4 giờ giảng dạy
Tạo chiến dịch quảng cáo Google AdWords để click vào các trang và chuyển đổi
Ra mắt chiến dịch quảng cáo FB với lượng tương tác lớn nhất, truy cập vào các trang web và bán hàng
Có được những cái click trên thiết bị di động tại Mỹ với giá 0.05$/ 1 quảng cáo di động đa phương tiện.
Tăng lượng tương tác trên Twitter với retweets ( Việc đăng lại hoặc chuyển tiếp tin nhắn) và lượt vào website sử dụng quảng cáo được tài trợ của Twitter.
Hiển thị một Phần đăng với các chuyên gia kinh doanh ở bảng thông tin trên Linkedln cùng với các quảng cáo.","Những doanh nghiệp muốn trải nghiệm loại hình quảng cáo trục tuyến Pay per click.
Những chủ doanh nghiệp tìm kiếm những lượt truy cập web từ những quảng cáo trả tiền trên các phương tiện truyền thông.
Những công ty muốn đào tạo nhân viên trong công ty để quản lý chiến dịch PPC",Phần 1: chào mừng đến với quảng cáo PPC trong năm 2015,,
,,,,,,,Bạn thu được gì từ khóa học này,3:59
,,,,,,,PPC thành công bắt đầu từ những chiến dịch nhỏ và kiểm tra rất nhiều nền tảng,5:06
,,,,,,,tôi phải làm gì với quảng cáo PPC của mình? tự bản thân bạn kiểm nghiệm,8:44
,,,,,,,Câu hỏi? tôi tạo ra giá trị từ khóa học này như thế nào?,1 trang
,,,,,,Phần 2: chiến lược quảng cáo PPC miễn phí: làm sao để những công ty khác quảng cáo cho bạn,,
,,,,,,,làm sao để quảng cáo PPC cho khả năng tối đa,6:22
,,,,,,,Bạn có thể có được những công ty chạy quảng cáo trả tiền một cách miễn phí cho bạn ở đâu?,4:57
,,,,,,,Quảng cáo PPC Miễn phí - Nghiên cứu tình huống thực tiễn: Udemy quảng cáo khóa học của chính mình trên FB,6:32
,,,,,,Phần 3: PPC với Google adwords,,
,,,,,,,Tạo ra một chiến dịch quảng cáo đơn giản và hiệu quả.,7:44
,,,,,,,Tạo ra một chiến dịch chỉ tìm kiếm và chỉ hiển thị ,7:54
,,,,,,,Chuyển đổi Google AdWords và phân thích từ khóa cho việc cải thiện ,9:15
,,,,,,,Tạo ra một chiến dịch Google AdWords mới dựa trên chiến dịch đã thành công trước đó.,8:51
,,,,,,,Lập danh mục quảng cáo và sao chép chiến dịch cùng với Google AdWords,7:48
,,,,,,Phần 4: Quảng cáo YouTube với Google AdWords cho video,,
,,,,,,,Tạo ra chiến dịch quảng cáo youtube một cách nhanh chóng.,10:36
,,,,,,,quảng cáo Youtube cho việc bán các khóa học của Udemy,8:53
,,,,,,Phần 5: Những chiến dịch quảng cáo FB,,
,,,,,,,"Quảng cáo Facebook cho chi phí click chuột thấp, tương tác, truy cập rẻ nhất",17:59
,,,,,,,"Quảng cao Facebook chuyển đổi khách sang các trang web, bán hàng với chi phí kích chuột thấp nhất từ USA.",19:47
,,,,,,Phần 6: Quảng cáo Twitter,,
,,,,,,,Các quảng cáo trên Twitter để click vào trang web sử dụng card với yêu cầu miễn phí,7:52
,,,,,,,Tạo ra chiến dịch tương tác Twitter sử dụng hình ảnh và link.,6:40
,,,,,,,chiến dịch bán hàng tương tác Twitter cho những yêu cầu trả phí ở Mỹ,5:33
,,,,,,Phần 7: linkdln tài trợ cho các Phần viết và quảng cáo,,
,,,,,,,Tạo ra một chiến dịch quảng cáo Linkedln cho Phần viết được tài trợ để click tới trang web.,8:49
,,,,,,Phần 8: Quảng cáo di động cùng Mmedia.,,
,,,,,,,Giới thiệu về quảng cáo di động.,3:21
,,,,,,,"Tạo banner quảng cáo cỡ 728 x90, 480x60, 300x250 bằng canva",12:51
,,,,,,,Tạo ra chiến dịch quảng cáo Mmedia cho 5 quảng cáo banner với 0.05$/click,11:01
,,,,,,Phần 9: Mẹo quảng cáo doanh nghiệp trả giá trên click và chiến lược với khách hàng.,,
,,,,,,,Thanh toán cho khách hàng theo chiến dịch và hàng tháng có vẻ là cách làm tốt nhất đối với bạn và khách hàng.,6:10
,,,,,,,Các yếu tố thành công quan trọng cho việc thiết lập trang web quảng cáo trả tiền cho mỗi lần nhấp chuột.,6:53
,,,,,,,Tại sao lại khó tìm được những khách hàng trả tiền cho mỗi lần nhấp chuột và đây là một thị trường tiềm năng,10:50
,,,,,,Phần 10: Tổng kết khóa học và tài liệu tặng kèm.,,
,,,,,,,Tổng kết về thành công của quảng cáo PPC.,6:06
,,,,,,,Google Analytics tạo URL liên kết trực tiếp.,1 trang
,,,,,,,"$ 0,01 CPC có khả thi tại Mỹ với Buzzcity?",2:19
,,,,,,,Ai là người sẵn sàng để quảng cáo trên Buzzzcity và nó tốn bao nhiêu tiền.,5:03