,,Mô tả khóa học,Yêu cầu,Lợi ích từ khóa học,Đối tượng mục tiêu,Chương trình giảng dạy,,
"Những bí mật CPA (định giá quảng cáo dựa trên hành động) : làm thế nào tôi kiếm đc $6,000+ một tháng - hiệu quả",Bước vào ngành công nghiệp một tỷ đô la sử dụng một chiến lược tàn bạo hiệu quả và hoàn toàn bí mật,"(Khóa học được cập nhật thông tin tới tháng 5 năm 2015
Hơn 3300 học sinh tham gia đã thành công
Khám phá bí mật mô hình kinh doanh ""1000 USD mỗi ngày"" 
Chỉ dành cho một số ít người
Sẽ thế nào nếu tôi nói với bạn....
Người bình thường như tôi và bạn có đã và đang sử dụng một quy trình kinh doanh ăn trộm được để lấy được miếng bánh của chúng ta một cái có hệ thống từ một ngành trị giá 1 tỷ đô?
Một chiến lược cực kỳ hiệu quả và hoàn toàn bí mật (cho đến tận bây giờ) là nguyên nhân xuất hiện nhiều tỷ phú hơn tất cả các chiến lược trực tuyến khác cộng lại
Một luồng tiền từ lợi nhuận thuần có hiệu quả chết người và tăng trưởng cực nhanh, đức mức cầu vượt cung 20 lần
Và đó là lý để bây giờ bạn có cơ hội để tham gia cùng họ, đơn giản bằng cách sao chép mô hình kinh doanh của chúng tôi
Hãy khám phá mô hình kinh doanh hiệu quả ngay cả khi 
bạn đã từng thất bại một cách thảm hại hết lần này đến lần khác
bạn đã từng là marketer vô dụng nhất trên trái đất này
bạn không hề có kinh nghiệm hay kỹ năng gì
bạn thậm chí không thể bán ma túy cho một thằng nghiện
Tổng quan khóa học
Mô hình kinh doanh này về
Được trả tiền mà không phải bán cái gì cả
Nghe có vẻ hay tới mức không thể tin được? Không phải vậy
CPA. bạn có thể đã từng nghe về nó
CPA là viết tắt của Cost Per Action (Chi phí trên mỗi hành động) và nó là ngành công nghiệp trị giá một tỷ đô với hàng loạt các tập đoàn như Best Buy, Vista Print, công ty tạo ra game Liên minh huyền thoại và hàng trăm công ty khác nhảy vào để kiếm lời từ nó
Đây là lý do vì sao nó khác biệt
Cùng với CPA, thay vì cố gắng thuyết phục, khuyên nhủ và van nài người ta mua một thứ gì đó, tất cả những gì bạn bạn làm là tặng cho họ thứ gì đấy miễn phí như phiếu giảm giá, vé trúng thưởng hoặc thử nghiệm miễn phí 
Chỉ thế thôi
Sau đó, để nhận được phần quà của mình, họ phải điền vào một cái form, xem một cái video sau đó nhập vào mã bưu chính cảu họ. Và sau khi họ thực hiện xong các bước đó, bạn sẽ được trả tiền
Cuối cùng thì, bạn đã ở đúng lúc đúng chỗ
Giờ đây, chúng ta đang trong thời kỳ hoàng kim của CPA
Nó vẫn dễ dàng để tham gia, nó phát triển như một cơn sóng thần mang tới đầy tiền, có nhiều lợi nhuận và CÒN LÂU mới bị bão hòa.
CPA là thứ sẽ ""mở khóa"" để bạn có thể...
Tạo một ""cỗ máy"" kinh doanh hái ra tiền ngay cả khi bạn đang ngủ
Đứng dậy và nói thẳng với sếp bạn: ""Tôi nghỉ""
Làm việc chỉ 2, 3 giờ mỗi ngày và dành thời gian còn lại để chơi golf thư giãn
Kiếm nhiều tiền hơn bạn bè mà ít phải chịu áp lực hay căng thẳng hơn
Ném luôn cái đồng hồ báo thức và tự lên thời gian biểu cho riêng mình
Bắt đầu kiếm tiền ngay trong không đầy 2 tuần
Không còn phải ""vật vã"" bán một sản phẩm 
Sở hữu một doanh nghiệp trực tuyến hợp pháp có thể khởi chạy nhanh chóng và dễ dàng
Và tôi VẪN CHƯA nói đến phần hay nhất... 
Bạn sẽ không cần
Website của riêng mình
Sản phẩm
Kinh nghiệm 
Kỹ năng bán hàng
Trình độ kỹ thuật
Cả núi tiền
Làm thuê dài hạn
Chuyên nghiệp trong ""thị trường ngách""
Là chuyên gia
Giới thiệu về HyperSonic Commissions - Vườn ươm doanh nghiệp cho CPA ""thế-hệ-tiếp-theo""
Rất nhiều bí mật bên trong có thể giúp những người như bạn và tôi có thể nhân số kinh phí lên hàng trăm lần ngay lập tức
Những bí mật sẽ đưa bạn đến sân chơi ngang tầm các CEOs, những nhà khởi nghiệp công nghệ, siêu chi nhánh và những nhà thầu với tài khoản ngân hàng có 6-7 con số trong nhiều năm
Hội đồng Hypersonic là giải thưởng cho chương trình đào tạo CPA bao gồm: 
29 video đào tạo từng bước (6 giờ học)
4 ví dụ thực tế 
Bản đồ tư duy
Slide trình chiếu
Ghi chú viết tay
Tài liệu nghiên cứu
Phần kiểm tra và mẫu trang đích (landing page) có tỉ lệ chuyển đổi cao tại 37 thị trường ngách khác nhau
Đến cuối khóa học...
Bạn sẽ biết chính xác kế hoạch bí mật để chọn lựa một lời đề nghị hấp dẫn, gửi hàng triệu khách đến một trang đích với tỉ lệ chuyển đổi cao (chỉ với 1 xu cho mỗi nhấp chuột) và thu lợi nhuận như một ông chủ!
Học cách thiết lập những chiến dịch gia tăng lưu lượng xem mang lợi nhuận (PPV) và nhắm đối tượng mục tiêu chính xác để không tốn thời gian mà tỉ lệ chuyển đổi cao tận nóc.
Bắt đầu gia tăng lợi nhuận như một ông chủ NGAY BÂY GIỜ!","Một máy tính kết nối internet
Mỗi ngày một giờ để thiết lập và tối ưu chiến dịch của bạn, theo dõi những thứ bạn thu được và kiếm nhiều tiền hơn nữa
Một chút ngân sách + 29 USD chi phí hosting","Hơn 40 Phần giảng và 6 giờ nội dung
""Đến hết khóa học, bạn sẽ biết chính xác kế hoạch bí mật để chọn lựa một lời đề nghị hấp 
dẫn, gửi hàng triệu khách đến một trang đích với tỉ lệ chuyển đổi cao 
(chỉ với 1 xu cho mỗi nhấp chuột) và thu lợi nhuận như một ông chủ!""
Học cách thiết lập những chiến dịch gia tăng lưu lượng xem mang lợi nhuận (PPV) và nhắm đối tượng mục tiêu chính xác để không tốn thời gian mà tỉ lệ chuyển đổi cao tận nóc.
Bắt đầu gia tăng lợi nhuận như một ông chủ NGAY BÂY GIỜ!","Bất cứ ai muốn kiếm tiền trực tuyến một cách dễ dàng
Marketing với PPV (tính phí theo lượt xem) cho người từ mới bắt đầu, trung cấp đến chuyên gia
Những nhà marketing với CPA (tính phí theo hành động)
""Những người từ 18 tuổi trở lên""",Chương 1: Cơ bản,,
,,,,,,,"Mở đầu
",11:10
,,,,,,,Tổng quan mạng tiếp thị CPA,4:50
,,,,,,,Bắt đầu với mạng tiếp thị CPA,10:30
,,,,,,,VPS hay Bust,5:44
,,,,,,,Kết nối các điểm,9:38
,,,,,,,Thiết kế WP,9:41
,,,,,,,Xử lý ứng dụng,13:10
,,,,,,,Lỗi dừng mạng lưới,8:02
,,,,,,,Kiến thức cơ bản - tổng kết,Văn bản
,,,,,,Chương 2: Những lời chào hàng hấp dẫn,,
,,,,,,,Những lời chào hàng triệu đô,8:27
,,,,,,,Những lời chào hàng siêu hấp dẫn,15:20
,,,,,,,Những lời chào hàng siêu hấp dẫn 2,9:09
,,,,,,,Liên minh huyền thoại,12:10
,,,,,,,Chào hàng hấp dẫn - tổng kết,Văn bản
,,,,,,Chương 3: Thăm dò thị trường,,
,,,,,,,Phân tích dữ liệu nhân khẩu học,11:32
,,,,,,,Bóc tách Similarweb,13:56
,,,,,,,Lên kế hoạch hiển thị với Google,6:50
,,,,,,,Do thám đối thủ cạnh tranh,9:22
,,,,,,,Black Pops,6:29
,,,,,,,Thăm dò thị trường - tổng kết,Văn bản
,,,,,,Chương 4: Sát thủ Trang đích,,
,,,,,,,Những quy tắc với Trang đích,13:31
,,,,,,,Trang đích hấp dẫn,12:42
,,,,,,,Làm chủ Dafont,14:34
,,,,,,,Kompozer Bulldozer,14:06
,,,,,,,Bí mật của  Squeeze Page,10:03
,,,,,,,Bí mật của  Squeze Page 2,12:46
,,,,,,,Cuộc cách mạng nhận sản phẩm bên ngoài,12:34
,,,,,,,Ma thuật của trang Audio Pal,7:45
,,,,,,,Sát thủ Trang đích - Tổng kết,Văn bản
,,,,,,Phần 5: Bùng nổ truy cập,,
,,,,,,,Chỉ đạo ảnh hưởng đến sự giận giữ,14:05
,,,,,,,Chỉ đạo ảnh hưởng đến sự giận giữ 2,16:02
,,,,,,,Sống lâu và phồn vinh,18:01
,,,,,,,Kết luận,4:17
,,,,,,,Bùng nổ truy cập - Tổng kết,Văn bản
,,,,,,Phần 6: Phụ lục,,
,,,,,,,Sách đen CPA - 7 lỗi sai lớn nhất của CPA,17 trang
,,,,,,,Bản đồ tư duy,1 page
,,,,,,,Ghi chép tay,24 trang
,,,,,,,Slide thuyết trình,1 page
,,,,,,,Tư liệu nghiên cứu của tôi,3 trang
,,,,,,,Trang đích Megapack - 37 ngóc ngách,