,,,,,,,,
Xây dựng một trang web thương mại điện tử với Wordpress ,"Tìm hiểu làm thế nào để bắt đầu kinh doanh trực tuyến và bán các sản phẩm của riêng bạn bằng cách sử dụng WordPress, WooCommerce và Printful.","Khóa học mở rộng này từng bước một sẽ dạy bạn cách để xây dựng một gian hàng trực tuyến với đầy đủ chức năng với WordPress, WooCommerce, và Printful. Sau khi hoàn thành khóa học, bạn sẽ được trang bị để bắt đầu kinh doanh trực tuyến sử dụng các sản phẩm của riêng bạn với chi phí trả trước tối thiểu.
Với 3 giờ video, nhiều khóa học phức tạp và 46 trang eBook, ""Xây dựng một trang Web thương mại điện tử với WordPresss và WooCommerce"" sẽ cung cấp cho bạn những kỹ năng cần thiết để xây dựng một doanh nghiệp trực tuyến thành công.
Trong khi giai đoạn khởi đầu một doanh nghiệp trực tuyến và kiếm sống bằng việc bán sản phẩm trên web chưa bao giờ lại dễ dàng đến thế nhưng lại có rất nhiều người không biết đến việc tạo một trang web đẹp mắt hoặc tìm kiếm sản phẩm chất lượng. Sau khóa học này, bạn sẽ có thể xây dựng một trang web thương mại điện tử mạnh mẽ với nhiều sản phẩm và có được bước khởi đầu trong cuộc hành trình thành một doanh nhân của bạn.
Với những video dễ theo dõi và hướng dẫn từng bước một, khóa học này sẽ cung cấp cho bạn sự hiểu biết sâu sắc về Thương mại điện tử và tiếp thị trực tuyến, bao gồm:
Các nguyên tắc cơ bản của thương mại điện tử
Làm thế nào để thiết lập tên miền của bạn và lưu trữ web 
Thiết kế web nâng cao
Tạo một gian hàng với WooCommerce và tích hợp nó với Printful
Một khóa học cấp tốc trong tiếp thị trực tuyến

Sau khóa học này, bạn sẽ được trang bị các kỹ năng và công cụ cần thiết để thành công trong thị trường trực tuyến. Khóa học này sẽ dạy bạn cách để xây dựng các trang web thương mại điện tử mạnh mẽ với WordPress và thị trường hóa hiệu quả cho chúng trên nhiều nền tảng.
Nếu bạn đã từng muốn bắt đầu một doanh nghiệp trực tuyến hoặc tìm hiểu phát triển Thương mại điện tử trên WordPress, hãy ghi danh ngay hôm nay và bắt đầu với việc xây dựng cửa hàng trực tuyến của riêng bạn!",Đây là khóa học trình độ bắt đầu được thiết kế để dạy cho người mới bắt đầu và các chuyên gia.,"Hơn 25 bài giảng và 3 giờ nội dung!
Cách để bắt đầu một doanh nghiệp với chi phí tối thiểu.
Xây dựng một trang web thương mại điện tử được tích hợp đầy đủ.
Làm thế nào để tìm thấy một nơi thích hợp có lợi.
Tạo trang web bằng cách sử dụng WordPress.org CMS.
Phân khúc thị trường hiệu quả cho trang web đến đối tượng mục tiêu.
Sử dụng Printful cho sản phẩm bỏ qua khâu vận chuyển tới khách hàng.
Sử dụng phương tiện truyền thông xã hội và các nền tảng quảng cáo để tiếp cận đối tượng mục tiêu của họ.
Cách thiết lập tên miền và lưu trữ web với Bluehost.
Tiến hành ý tưởng riêng của họ cho một doanh nghiệp trực tuyến.","Những người muốn bắt đầu một doanh nghiệp với chi phí tối thiểu.
Những người quan tâm đến thương mại điện tử và kinh doanh trực tuyến.
Những người muốn tìm hiểu WordPress phát triển website.
Những người muốn tìm hiểu làm thế nào để bán sản phẩm trực tuyến.
Những người muốn giảm thiểu rủi ro của họ trong khởi nghiệp kinh doanh trực tuyến.",Phần 1: Mở đầu,,
,,,,,,,Tổng quát,3:59
,,,,,,Phần 2: Nguyên tắc cơ bản của thương mại điện tử,,
,,,,,,,Thương mại điện tử là gì?,3:11
,,,,,,,Các loại hình thương mại điện tử,2:11
,,,,,,,Tìm Ngách thích hợp của bạn,2:04
,,,,,,,KIỂM TRA THỰC TẾ!,1:16
,,,,,,Phần 3: Bắt đầu,,
,,,,,,,Tổng quan về WordPress.org ,1:31
,,,,,,,Tổng quan về thePrintful.com ,1:16
,,,,,,,Tài liệu khóa học,Văn bản
,,,,,,,Thiết lập tên miền của bạn và lưu trữ web,3:18
,,,,,,Phần 4: Cơ sở Thiết kế Web,,
,,,,,,,Cài đặt WordPress,2:06
,,,,,,,Bảng điều khiển WordPress,8:22
,,,,,,,Tạo nền móng của trang web của bạn,3:56
,,,,,,Phần 5: Xây dựng cửa hàng trực tuyến của bạn,,
,,,,,,,WooCommerce Plugin,7:00
,,,,,,,Tìm kiếm và cài đặt một chủ đề Thương mại điện tử đẹp (và miễn phí),4:56
,,,,,,,Tạo gian hàng của bạn,15:57
,,,,,,Phần 6: Thiết kế Web nâng cao,,
,,,,,,,Tùy chỉnh chủ đề,18:48
,,,,,,,Phương pháp vận chuyển,5:23
,,,,,,,Tích hợp gian hàng với Printful và các đơn đặt hàng đang sản xuất,7:12
,,,,,,Phần 7: Khóa học tiếp thị trực tuyến,,
,,,,,,,SEO và Google Analytics,3:02
,,,,,,,Giới thiệu về blog,4:14
,,,,,,,Tiếp thị Truyền thông xã hội,10:38
,,,,,,,Email marketing,6:21
,,,,,,,Google AdWords,4:21
,,,,,,Phần 8: Kết luận,,
,,,,,,,"""Những gì bây giờ""",1:07
,,,,,,Phần 9: THÊM! eBook miễn phí ,,
,,,,,,,"Doanh nhân khởi nghiệp: eBook ""Bắt đầu kinh doanh trực tuyến Với $ 25"" ",48 trang 